{
  "event_id": "CONT_0001",
  "session_id": "SESSION_0001",
  "event_type": "event",
  "actors": ["CHARACTER_PLACEHOLDER"],
  "summary": "A neutral example of an event that actually occurred during recorded continuation play.",
  "facts_established": ["A neutral fact was established during play."],
  "relationships_changed": [],
  "knowledge_changed": [],
  "state_changes": [],
  "source_record": "sources/continuation/SESSION_0001.md",
  "canon_status": "confirmed",
  "notes": "Example only; contains no Campaign fact."
}
